{
  "schema_version": 2.0,
  "bundle_type": "mixed",
  "deliverables": [
    "docs/spec.md",
    "src/main.py"
  ],
  "content_hashes": {
    "docs/spec.md": "e3b0c44298fc1c149afbf4c8996fb92427ae41e4649b934ca495991b7852b855",
    "src/main.py": "a576c24f2b963b516b3f6f140656667d4fdf8a7351662d515a6b0c242b934b12"
  },
  "provenance": {
    "toolchain": "multi-tool-combo",
    "builder": "agy-generalist-agent"
  },
  "source_revision": {
    "source_commit_sha": "a1b2c3d4e5f607182930415263748596a7b8c9d0",
    "base_commit_sha": "f0e9d8c7b6a50493827160514233221100ffeedd",
    "branch": "feature/gro-4112-universal-manifest"
  },
  "path_scope": {
    "allowed_paths": [
      "**/*"
    ],
    "touched_paths": [
      "docs/spec.md",
      "src/main.py"
    ]
  },
  "privacy_retention": {
    "privacy_level": "internal",
    "retention_status": "retained",
    "retention_reasons": [
      "mixed_bundle_files"
    ],
    "retention_policy": "default"
  },
  "type_specific_proofs": {
    "mixed": {
      "submanifests_validated": 2
    }
  },
  "preview_handles": [],
  "licenses": [
    "MIT"
  ],
  "non_claims": [],
  "candidate_sha_destination": {
    "candidate_sha": "a1b2c3d4e5f607182930415263748596a7b8c9d0",
    "destination_branch": "main"
  },
  "review_digest": "a576c24f2b963b516b3f6f140656667d4fdf8a7351662d515a6b0c242b934b12",
  "integration_receipt": {
    "receipt_id": "rec-mixed",
    "timestamp": "2026-07-21T08:01:00Z",
    "status": "integrated"
  },
  "rollback": {
    "revert_instructions": "git revert",
    "script_path": "scripts/revert_mixed.sh"
  },
  "post_integration_proof": "mixed-bundle-verification-check-ok",
  "marker": "UNIVERSAL_RESULT_MANIFEST_V2_OK"
}
