{
  "schema_version": 2.0,
  "bundle_type": "audio",
  "deliverables": [
    "media/sfx.wav"
  ],
  "content_hashes": {
    "media/sfx.wav": "e3b0c44298fc1c149afbf4c8996fb92427ae41e4649b934ca495991b7852b855"
  },
  "provenance": {
    "toolchain": "audacity-v3.0",
    "builder": "agy-audio-synthesizer"
  },
  "source_revision": {
    "source_commit_sha": "a1b2c3d4e5f607182930415263748596a7b8c9d0",
    "base_commit_sha": "f0e9d8c7b6a50493827160514233221100ffeedd",
    "branch": "feature/gro-4112-universal-manifest"
  },
  "path_scope": {
    "allowed_paths": [
      "media/**/*"
    ],
    "touched_paths": [
      "media/sfx.wav"
    ]
  },
  "privacy_retention": {
    "privacy_level": "public",
    "retention_status": "retained",
    "retention_reasons": [
      "game_sfx"
    ],
    "retention_policy": "default"
  },
  "type_specific_proofs": {
    "audio": {
      "channels": 2,
      "sample_rate_hz": 44100,
      "duration_seconds": 1.25
    }
  },
  "preview_handles": [
    "media/sfx.wav"
  ],
  "licenses": [
    "CC0-1.0"
  ],
  "non_claims": [],
  "candidate_sha_destination": {
    "candidate_sha": "a1b2c3d4e5f607182930415263748596a7b8c9d0",
    "destination_branch": "main"
  },
  "review_digest": "a576c24f2b963b516b3f6f140656667d4fdf8a7351662d515a6b0c242b934b12",
  "integration_receipt": {
    "receipt_id": "rec-audio",
    "timestamp": "2026-07-21T08:01:00Z",
    "status": "integrated"
  },
  "rollback": {
    "revert_instructions": "git revert",
    "script_path": "scripts/revert_audio.sh"
  },
  "post_integration_proof": "audio-playback-checksum-ok",
  "marker": "UNIVERSAL_RESULT_MANIFEST_V2_OK"
}
